{
  "schema_version": "1.0.0",
  "purpose": "source-backed human review navigation; not approved annotation",
  "dataset_id": "vbot-rag-v2",
  "dataset_version": "2.0.0-dev.5",
  "dataset_fingerprint_sha256": "8ee20cdad3bf0f1dfc0bfe0e89e868b4d38c72481feda6cd0151b581d61581d6",
  "corpus_id": "vbot-public-safe",
  "corpus_version": "1.0.0",
  "corpus_fingerprint_sha256": "dff71736dde3ab944cf55400a02707f802702a7f6a265b5b47e24fe8a677f4fe",
  "evidence_catalog_sha256": "c15148e0aa42d867edbb6698c1b6f112f8767f557a8fdc172f497d90f4edf326",
  "case_count": 49,
  "answerable_cases": 38,
  "unanswerable_cases": 11,
  "cases": [
    {
      "case_id": "v1-q01",
      "legacy_id": "q01",
      "question": "What is the gateway's failover ladder, in order?",
      "answerability": "answerable",
      "current_answer_action": "answer",
      "legacy_reference_answer": "The first failover step is to retry the same deployment. The second step is cooldown via the circuit breaker. The final step is model-level fallback.",
      "legacy_relevant_headings": [
        "gateway-readme::vbot-model-gateway"
      ],
      "candidate_evidence": [
        {
          "heading_key": "gateway-readme::vbot-model-gateway",
          "candidate_blocks": [
            {
              "evidence_id": "gateway-readme::vbot-model-gateway::span-50ccea07666a73db",
              "block_type": "heading",
              "start_line": 3,
              "end_line": 3,
              "text": "Vbot Model Gateway"
            },
            {
              "evidence_id": "gateway-readme::vbot-model-gateway::span-6d641315158792e7",
              "block_type": "prose",
              "start_line": 5,
              "end_line": 10,
              "text": "Multi-provider LLM gateway for the Vbot platform, built on [LiteLLM proxy].\nImplements the failover ladder from the provider-reliability research\n(doc 09) per the ADR in doc 15: **retry same deployment → cooldown\n(circuit breaker) → model-level fallback** — because our primary RP model\n(Euryale 70B) is single-host on OpenRouter, so a hot-standby model IS the\nsecond rung, not a nice-to-have."
            },
            {
              "evidence_id": "gateway-readme::vbot-model-gateway::span-3e6ca3c30135c8d2",
              "block_type": "prose",
              "start_line": 12,
              "end_line": 14,
              "text": "**Scope note:** the model lab stays on direct OpenRouter with NO fallback —\nsilent model swapping would poison blind ratings. The gateway is a product\nconcern, not a lab concern."
            }
          ]
        }
      ],
      "current_review_status": "migrated_pending_v2_review",
      "human_decision_required": true,
      "model_proposal_status": "source_navigation_only"
    },
    {
      "case_id": "v1-q02",
      "legacy_id": "q02",
      "question": "Why is a hot-standby model a necessity rather than a nice-to-have for the RP primary?",
      "answerability": "answerable",
      "current_answer_action": "answer",
      "legacy_reference_answer": "The primary RP model, Euryale 70B, is single-host on OpenRouter. A hot-standby model is therefore the available second failover rung, making it necessary.",
      "legacy_relevant_headings": [
        "gateway-readme::vbot-model-gateway"
      ],
      "candidate_evidence": [
        {
          "heading_key": "gateway-readme::vbot-model-gateway",
          "candidate_blocks": [
            {
              "evidence_id": "gateway-readme::vbot-model-gateway::span-50ccea07666a73db",
              "block_type": "heading",
              "start_line": 3,
              "end_line": 3,
              "text": "Vbot Model Gateway"
            },
            {
              "evidence_id": "gateway-readme::vbot-model-gateway::span-6d641315158792e7",
              "block_type": "prose",
              "start_line": 5,
              "end_line": 10,
              "text": "Multi-provider LLM gateway for the Vbot platform, built on [LiteLLM proxy].\nImplements the failover ladder from the provider-reliability research\n(doc 09) per the ADR in doc 15: **retry same deployment → cooldown\n(circuit breaker) → model-level fallback** — because our primary RP model\n(Euryale 70B) is single-host on OpenRouter, so a hot-standby model IS the\nsecond rung, not a nice-to-have."
            },
            {
              "evidence_id": "gateway-readme::vbot-model-gateway::span-3e6ca3c30135c8d2",
              "block_type": "prose",
              "start_line": 12,
              "end_line": 14,
              "text": "**Scope note:** the model lab stays on direct OpenRouter with NO fallback —\nsilent model swapping would poison blind ratings. The gateway is a product\nconcern, not a lab concern."
            }
          ]
        }
      ],
      "current_review_status": "migrated_pending_v2_review",
      "human_decision_required": true,
      "model_proposal_status": "source_navigation_only"
    },
    {
      "case_id": "v1-q03",
      "legacy_id": "q03",
      "question": "Does the model lab use the gateway's fallback, and why or why not?",
      "answerability": "answerable",
      "current_answer_action": "answer",
      "legacy_reference_answer": "The model lab stays on direct OpenRouter and does not use gateway fallback. Fallback is disabled because silent model swapping would invalidate blind ratings.",
      "legacy_relevant_headings": [
        "gateway-readme::vbot-model-gateway"
      ],
      "candidate_evidence": [
        {
          "heading_key": "gateway-readme::vbot-model-gateway",
          "candidate_blocks": [
            {
              "evidence_id": "gateway-readme::vbot-model-gateway::span-50ccea07666a73db",
              "block_type": "heading",
              "start_line": 3,
              "end_line": 3,
              "text": "Vbot Model Gateway"
            },
            {
              "evidence_id": "gateway-readme::vbot-model-gateway::span-6d641315158792e7",
              "block_type": "prose",
              "start_line": 5,
              "end_line": 10,
              "text": "Multi-provider LLM gateway for the Vbot platform, built on [LiteLLM proxy].\nImplements the failover ladder from the provider-reliability research\n(doc 09) per the ADR in doc 15: **retry same deployment → cooldown\n(circuit breaker) → model-level fallback** — because our primary RP model\n(Euryale 70B) is single-host on OpenRouter, so a hot-standby model IS the\nsecond rung, not a nice-to-have."
            },
            {
              "evidence_id": "gateway-readme::vbot-model-gateway::span-3e6ca3c30135c8d2",
              "block_type": "prose",
              "start_line": 12,
              "end_line": 14,
              "text": "**Scope note:** the model lab stays on direct OpenRouter with NO fallback —\nsilent model swapping would poison blind ratings. The gateway is a product\nconcern, not a lab concern."
            }
          ]
        }
      ],
      "current_review_status": "migrated_pending_v2_review",
      "human_decision_required": true,
      "model_proposal_status": "source_navigation_only"
    },
    {
      "case_id": "v1-q04",
      "legacy_id": "q04",
      "question": "At what URL does the gateway expose its OpenAI-compatible endpoint?",
      "answerability": "answerable",
      "current_answer_action": "answer",
      "legacy_reference_answer": "The OpenAI-compatible gateway endpoint is http://127.0.0.1:4000/v1.",
      "legacy_relevant_headings": [
        "gateway-readme::what-it-does-today"
      ],
      "candidate_evidence": [
        {
          "heading_key": "gateway-readme::what-it-does-today",
          "candidate_blocks": [
            {
              "evidence_id": "gateway-readme::what-it-does-today::span-4bf18d7b35277790",
              "block_type": "heading",
              "start_line": 16,
              "end_line": 16,
              "text": "What it does today"
            },
            {
              "evidence_id": "gateway-readme::what-it-does-today::span-69cc26a1040fa913",
              "block_type": "list",
              "start_line": 18,
              "end_line": 20,
              "text": "- OpenAI-compatible endpoint at `http://127.0.0.1:4000/v1` fronting\n  OpenRouter (later: direct providers + self-hosted vLLM behind the same\n  interface)."
            },
            {
              "evidence_id": "gateway-readme::what-it-does-today::span-c028d97567bbc915",
              "block_type": "list",
              "start_line": 21,
              "end_line": 22,
              "text": "- `rp-primary` (Euryale 70B) with automatic fallback to `rp-fallback`\n  (Hermes-4 70B) after retries are exhausted."
            },
            {
              "evidence_id": "gateway-readme::what-it-does-today::span-e3df604febc9f7cf",
              "block_type": "list",
              "start_line": 23,
              "end_line": 24,
              "text": "- Cooldowns: a deployment failing >3×/min is pulled from rotation for 30s\n  (Redis-backed, so state survives multi-replica later)."
            },
            {
              "evidence_id": "gateway-readme::what-it-does-today::span-cf1ae40810acc48f",
              "block_type": "list",
              "start_line": 25,
              "end_line": 26,
              "text": "- `failover-demo` model: intentionally broken credentials, exists so the\n  smoke test can PROVE fallback fires end-to-end instead of trusting config."
            },
            {
              "evidence_id": "gateway-readme::what-it-does-today::span-f95b81f497551249",
              "block_type": "list",
              "start_line": 27,
              "end_line": 27,
              "text": "- Auth via master key — clients never see the OpenRouter key."
            }
          ]
        }
      ],
      "current_review_status": "migrated_pending_v2_review",
      "human_decision_required": true,
      "model_proposal_status": "source_navigation_only"
    },
    {
      "case_id": "v1-q05",
      "legacy_id": "q05",